Titre,Date,Lieu,Description,Type,Lien billetterie,Afficher
"Récital Poulenc & Debussy","2025-03-15T19:00:00","Salle Cortot, Paris","Récital autour de la mélodie française avec au piano Jean-Marc Fontaine","Récital","https://billetterie.exemple.com","true"
"La Traviata - Flora Bervoix","2025-04-02T20:00:00","Opéra-Théâtre de Metz","Rôle de Flora Bervoix dans la production de La Traviata de Verdi","Opéra","https://opera-metz.fr","true"
"Stabat Mater de Pergolèse","2025-04-18T20:30:00","Cathédrale de Nancy","Concert de musique sacrée, alto solo dans le Stabat Mater","Concert","","true"
"Masterclass Technique vocale","2025-05-10T14:00:00","Conservatoire de Nancy","Masterclass ouverte sur la technique du bel canto","Masterclass","","true"
"Les Contes d'Hoffmann","2025-05-25T20:00:00","Opéra de Reims","Rôle de La Muse/Nicklausse","Opéra","https://operadereims.fr","true"
"Festival d'Aix-en-Provence","2025-07-15T21:00:00","Théâtre de l'Archevêché","Participation au concert des jeunes talents","Concert","https://festival-aix.com","true"
"Petite Messe Solennelle","2025-09-12T20:00:00","Basilique Saint-Épvre, Nancy","Rossini - Alto solo","Concert","","true"
"Carmen - Mercedes","2025-11-03T19:30:00","Opéra de Lille","Rôle de Mercedes dans Carmen de Bizet","Opéra","https://opera-lille.fr","true"